{
  "$schema": "https://json-schema.org/draft/2020-12/schema",
  "title": "agents-cooperation config",
  "description": "Owner agent scheduling config. Structure lives here; cross-object rules (references, kind-specific effort sets, launch support per kind, one enabled owner per engine, parallel limits) are enforced by scripts/agents-config.ts validate.",
  "type": "object",
  "required": [
    "version",
    "engines",
    "owners",
    "workers"
  ],
  "additionalProperties": false,
  "properties": {
    "$schema": {
      "type": "string"
    },
    "version": {
      "const": 1
    },
    "engines": {
      "description": "Agent CLI engines keyed by engine id.",
      "type": "object",
      "propertyNames": {
        "$ref": "#/$defs/id"
      },
      "additionalProperties": {
        "$ref": "#/$defs/engine"
      }
    },
    "owners": {
      "description": "Owner agents keyed by owner id. Each enabled engine has at most one enabled owner.",
      "type": "object",
      "propertyNames": {
        "$ref": "#/$defs/id"
      },
      "additionalProperties": {
        "$ref": "#/$defs/owner"
      }
    },
    "workers": {
      "description": "Workers keyed by worker id; every id ends with _worker.",
      "type": "object",
      "propertyNames": {
        "pattern": "^[a-z][a-z0-9_]{0,32}_worker$"
      },
      "additionalProperties": {
        "$ref": "#/$defs/worker"
      }
    }
  },
  "$defs": {
    "id": {
      "type": "string",
      "pattern": "^[a-z][a-z0-9_]{0,39}$"
    },
    "workerId": {
      "type": "string",
      "pattern": "^[a-z][a-z0-9_]{0,32}_worker$"
    },
    "effort": {
      "description": "Engine-native effort. Allowed set depends on the engine kind: claude low|medium|high|xhigh|max; codex minimal|low|medium|high|xhigh|max; grok none|minimal|low|medium|high|xhigh|max; other kinds (e.g. opencode, whose --variant is provider/model specific) any non-empty string. Checked by the script.",
      "type": "string",
      "minLength": 1
    },
    "engine": {
      "type": "object",
      "required": [
        "enabled",
        "kind"
      ],
      "additionalProperties": false,
      "properties": {
        "enabled": {
          "type": "boolean"
        },
        "kind": {
          "description": "A herdr agent start --kind value.",
          "enum": [
            "pi",
            "claude",
            "codex",
            "gemini",
            "cursor",
            "devin",
            "agy",
            "cline",
            "omp",
            "mastracode",
            "opencode",
            "copilot",
            "kimi",
            "kiro",
            "droid",
            "amp",
            "grok",
            "hermes",
            "kilo",
            "qodercli",
            "qwen",
            "letta",
            "maki",
            "muse"
          ]
        },
        "native_subagents": {
          "description": "Whether the engine can spawn sub-agents natively. Only claude, codex and grok can.",
          "type": "boolean"
        }
      },
      "if": {
        "required": [
          "native_subagents"
        ],
        "properties": {
          "native_subagents": {
            "const": true
          }
        }
      },
      "then": {
        "properties": {
          "kind": {
            "enum": [
              "claude",
              "codex",
              "grok"
            ]
          }
        }
      }
    },
    "owner": {
      "type": "object",
      "required": [
        "enabled",
        "engine",
        "model",
        "effort",
        "workers",
        "max_parallel"
      ],
      "additionalProperties": false,
      "properties": {
        "enabled": {
          "type": "boolean"
        },
        "engine": {
          "$ref": "#/$defs/id"
        },
        "model": {
          "type": "string",
          "minLength": 1
        },
        "effort": {
          "$ref": "#/$defs/effort"
        },
        "workers": {
          "description": "Worker ids in priority order; resolve takes the first available one (or the first available one carrying the requested tag).",
          "type": "array",
          "minItems": 1,
          "uniqueItems": true,
          "items": {
            "$ref": "#/$defs/workerId"
          }
        },
        "max_parallel": {
          "description": "Cap on workers (native and herdr) running concurrently for this owner; the owner enforces it by counting running ledger entries.",
          "type": "integer",
          "minimum": 1
        }
      }
    },
    "worker": {
      "type": "object",
      "required": [
        "enabled",
        "engine",
        "model",
        "effort"
      ],
      "additionalProperties": false,
      "properties": {
        "enabled": {
          "type": "boolean"
        },
        "engine": {
          "$ref": "#/$defs/id"
        },
        "model": {
          "type": "string",
          "minLength": 1
        },
        "effort": {
          "$ref": "#/$defs/effort"
        },
        "description": {
          "type": "string"
        },
        "tags": {
          "description": "Domain tags used by resolve --tag <t> to prefer a matching worker.",
          "type": "array",
          "uniqueItems": true,
          "items": {
            "type": "string",
            "pattern": "^[a-z][a-z0-9-]{0,31}$"
          }
        }
      }
    }
  }
}
